{
  "$schema": "https://json-schema.org/draft/2020-12/schema",
  "$id": "https://oathon.dev/spec/evidence/v0.1/event.schema.json",
  "title": "Oathon Evidence Event v0.1",
  "type": "object",
  "required": [
    "event_id",
    "spec_version",
    "org_id",
    "agent_id",
    "writer_id",
    "segment_id",
    "sequence",
    "occurred_at",
    "event_type",
    "metadata",
    "digests",
    "capture_source",
    "prev_hash",
    "event_hash"
  ],
  "additionalProperties": false,
  "properties": {
    "event_id": {
      "$ref": "#/$defs/uuidv7"
    },
    "spec_version": {
      "const": "0.1"
    },
    "org_id": {
      "$ref": "#/$defs/nonEmptyString"
    },
    "mandate_id": {
      "$ref": "#/$defs/uuidv7"
    },
    "agent_id": {
      "$ref": "#/$defs/nonEmptyString"
    },
    "writer_id": {
      "$ref": "#/$defs/uuidv7"
    },
    "segment_id": {
      "$ref": "#/$defs/uuidv7"
    },
    "sequence": {
      "$ref": "#/$defs/safeNonNegativeInt"
    },
    "operation_id": {
      "$ref": "#/$defs/uuidv7"
    },
    "occurred_at": {
      "$ref": "#/$defs/timestamp"
    },
    "event_type": {
      "enum": [
        "action_requested",
        "action_executed",
        "approval_requested",
        "approval_granted",
        "approval_denied",
        "error",
        "escalation",
        "config_change"
      ]
    },
    "metadata": {
      "type": "object"
    },
    "evaluation_metadata": {
      "type": "object",
      "propertyNames": {
        "$ref": "#/$defs/jsonPointer"
      },
      "additionalProperties": {
        "$ref": "#/$defs/scalar"
      }
    },
    "digests": {
      "type": "object",
      "propertyNames": {
        "type": "string",
        "minLength": 1
      },
      "additionalProperties": {
        "$ref": "#/$defs/digest"
      }
    },
    "capture_source": {
      "enum": [
        "sdk_direct",
        "otel"
      ]
    },
    "prev_hash": {
      "oneOf": [
        {
          "$ref": "#/$defs/digest"
        },
        {
          "type": "null"
        }
      ]
    },
    "event_hash": {
      "$ref": "#/$defs/digest"
    }
  },
  "allOf": [
    {
      "if": {
        "properties": {
          "event_type": {
            "enum": [
              "action_requested",
              "action_executed"
            ]
          }
        }
      },
      "then": {
        "required": [
          "mandate_id",
          "operation_id",
          "evaluation_metadata"
        ],
        "properties": {
          "metadata": {
            "type": "object",
            "required": [
              "action"
            ],
            "additionalProperties": false,
            "properties": {
              "action": {
                "$ref": "#/$defs/nonEmptyString"
              },
              "status": {
                "enum": [
                  "succeeded",
                  "failed"
                ]
              }
            }
          },
          "digests": {
            "type": "object",
            "required": [
              "action_params"
            ]
          }
        }
      },
      "else": {
        "not": {
          "required": [
            "evaluation_metadata"
          ]
        }
      }
    },
    {
      "if": {
        "properties": {
          "event_type": {
            "enum": [
              "approval_requested",
              "approval_granted",
              "approval_denied"
            ]
          }
        }
      },
      "then": {
        "required": [
          "mandate_id",
          "operation_id"
        ],
        "properties": {
          "metadata": {
            "type": "object",
            "required": [
              "action"
            ],
            "additionalProperties": false,
            "properties": {
              "action": {
                "$ref": "#/$defs/nonEmptyString"
              },
              "approver_ref": {
                "type": "string"
              }
            }
          }
        }
      }
    },
    {
      "if": {
        "properties": {
          "event_type": {
            "const": "error"
          }
        }
      },
      "then": {
        "properties": {
          "metadata": {
            "type": "object",
            "required": [
              "error_class"
            ],
            "additionalProperties": false,
            "properties": {
              "error_class": {
                "$ref": "#/$defs/nonEmptyString"
              }
            }
          }
        }
      }
    },
    {
      "if": {
        "properties": {
          "event_type": {
            "const": "escalation"
          }
        }
      },
      "then": {
        "properties": {
          "metadata": {
            "type": "object",
            "required": [
              "reason_class"
            ],
            "additionalProperties": false,
            "properties": {
              "reason_class": {
                "$ref": "#/$defs/nonEmptyString"
              }
            }
          }
        }
      }
    },
    {
      "if": {
        "properties": {
          "event_type": {
            "const": "config_change"
          }
        }
      },
      "then": {
        "properties": {
          "metadata": {
            "type": "object",
            "required": [
              "change_class"
            ],
            "additionalProperties": false,
            "properties": {
              "change_class": {
                "$ref": "#/$defs/nonEmptyString"
              }
            }
          }
        }
      }
    }
  ],
  "$defs": {
    "uuidv7": {
      "type": "string",
      "pattern": "^[0-9a-f]{8}-[0-9a-f]{4}-7[0-9a-f]{3}-[89ab][0-9a-f]{3}-[0-9a-f]{12}$"
    },
    "timestamp": {
      "type": "string",
      "description": "CRYPTO-006: RFC 3339 UTC, millisecond precision",
      "pattern": "^\\d{4}-\\d{2}-\\d{2}T\\d{2}:\\d{2}:\\d{2}\\.\\d{3}Z$"
    },
    "digest": {
      "type": "string",
      "pattern": "^sha256:[A-Za-z0-9_-]{43}$"
    },
    "keyId": {
      "type": "string",
      "pattern": "^ed25519:[A-Za-z0-9_-]{43}$"
    },
    "publicKey": {
      "type": "string",
      "description": "32 raw Ed25519 public-key bytes, base64url no padding (CRYPTO-005)",
      "pattern": "^[A-Za-z0-9_-]{43}$"
    },
    "sigValue": {
      "type": "string",
      "description": "64 Ed25519 signature bytes, base64url no padding",
      "pattern": "^[A-Za-z0-9_-]{86}$"
    },
    "jsonPointer": {
      "type": "string",
      "pattern": "^/(?:[^/~]|~0|~1)*(?:/(?:[^/~]|~0|~1)*)*$"
    },
    "scalar": {
      "type": [
        "string",
        "number",
        "boolean",
        "null"
      ]
    },
    "nonEmptyString": {
      "type": "string",
      "minLength": 1
    },
    "safeNonNegativeInt": {
      "type": "integer",
      "minimum": 0,
      "maximum": 9007199254740991
    },
    "signature": {
      "type": "object",
      "required": [
        "alg",
        "key_id",
        "signed_at",
        "value"
      ],
      "additionalProperties": false,
      "properties": {
        "alg": {
          "const": "Ed25519"
        },
        "key_id": {
          "$ref": "#/$defs/keyId"
        },
        "signed_at": {
          "$ref": "#/$defs/timestamp"
        },
        "value": {
          "$ref": "#/$defs/sigValue"
        }
      }
    },
    "money": {
      "type": "object",
      "required": [
        "minor_units",
        "currency"
      ],
      "additionalProperties": false,
      "properties": {
        "minor_units": {
          "type": "integer",
          "minimum": -9007199254740991,
          "maximum": 9007199254740991
        },
        "currency": {
          "type": "string",
          "pattern": "^[A-Z]{3}$"
        }
      }
    },
    "comparison": {
      "type": "object",
      "required": [
        "path",
        "op",
        "value"
      ],
      "additionalProperties": false,
      "properties": {
        "path": {
          "$ref": "#/$defs/jsonPointer"
        },
        "op": {
          "enum": [
            "eq",
            "neq",
            "lt",
            "lte",
            "gt",
            "gte",
            "in"
          ]
        },
        "value": {}
      },
      "allOf": [
        {
          "if": {
            "properties": {
              "op": {
                "enum": [
                  "eq",
                  "neq"
                ]
              }
            }
          },
          "then": {
            "properties": {
              "value": {
                "$ref": "#/$defs/scalar"
              }
            }
          }
        },
        {
          "if": {
            "properties": {
              "op": {
                "enum": [
                  "lt",
                  "lte",
                  "gt",
                  "gte"
                ]
              }
            }
          },
          "then": {
            "properties": {
              "value": {
                "type": "number"
              }
            }
          }
        },
        {
          "if": {
            "properties": {
              "op": {
                "const": "in"
              }
            }
          },
          "then": {
            "properties": {
              "value": {
                "type": "array",
                "minItems": 1,
                "items": {
                  "$ref": "#/$defs/scalar"
                }
              }
            }
          }
        }
      ]
    },
    "constraint": {
      "oneOf": [
        {
          "type": "object",
          "required": [
            "path",
            "op",
            "value"
          ],
          "additionalProperties": false,
          "properties": {
            "action": {
              "$ref": "#/$defs/nonEmptyString"
            },
            "path": {
              "$ref": "#/$defs/jsonPointer"
            },
            "op": {
              "enum": [
                "eq",
                "neq",
                "lt",
                "lte",
                "gt",
                "gte",
                "in"
              ]
            },
            "value": {}
          },
          "allOf": [
            {
              "if": {
                "properties": {
                  "op": {
                    "enum": [
                      "eq",
                      "neq"
                    ]
                  }
                }
              },
              "then": {
                "properties": {
                  "value": {
                    "$ref": "#/$defs/scalar"
                  }
                }
              }
            },
            {
              "if": {
                "properties": {
                  "op": {
                    "enum": [
                      "lt",
                      "lte",
                      "gt",
                      "gte"
                    ]
                  }
                }
              },
              "then": {
                "properties": {
                  "value": {
                    "type": "number"
                  }
                }
              }
            },
            {
              "if": {
                "properties": {
                  "op": {
                    "const": "in"
                  }
                }
              },
              "then": {
                "properties": {
                  "value": {
                    "type": "array",
                    "minItems": 1,
                    "items": {
                      "$ref": "#/$defs/scalar"
                    }
                  }
                }
              }
            }
          ]
        },
        {
          "type": "object",
          "required": [
            "op",
            "value"
          ],
          "additionalProperties": false,
          "properties": {
            "action": {
              "$ref": "#/$defs/nonEmptyString"
            },
            "op": {
              "const": "max_count_per_utc_day"
            },
            "value": {
              "$ref": "#/$defs/safeNonNegativeInt"
            }
          }
        }
      ]
    }
  }
}
